{
  "schemaVersion": "jobservatory.data-card.v1",
  "generatedAt": "2026-08-25T09:52:56+00:00",
  "corpus": {
    "schemaVersion": "0.2.0",
    "sha256": "sha256:9f56f802a8f8e99b7fb3422a01e5f8d11f749dd07434ed49b1f93ce3777d5576",
    "unitOfAnalysis": "A public job-listing observation retrieved at a particular time.",
    "descriptionPolicy": "metadata-and-evidence-only"
  },
  "coverage": {
    "employers": 54,
    "observations": 2702,
    "configuredSources": 54,
    "successfulSources": 54,
    "atsProviders": {
      "greenhouse": 41,
      "lever": 5,
      "ashby": 7,
      "smartrecruiters": 1
    },
    "sectors": {
      "frontier-model-lab": 5,
      "ai-data-platform": 1,
      "defense-robotics": 2,
      "enterprise-search": 1,
      "ai-cloud": 2,
      "data-and-ai-platform": 1,
      "financial-technology": 5,
      "internet-infrastructure": 1,
      "education-technology": 1,
      "consumer-platform": 2,
      "interactive-entertainment": 1,
      "ai-safety-research": 1,
      "legal-technology": 1,
      "healthcare-ai": 2,
      "industrial-iot": 1,
      "design-collaboration": 1,
      "commerce-marketplace": 2,
      "biotechnology": 1,
      "energy": 1,
      "manufacturing": 1,
      "agriculture": 1,
      "professional-services": 1,
      "travel": 2,
      "mobility": 1,
      "health-insurance": 1,
      "hr-technology": 1,
      "productivity": 1,
      "developer-platform": 1,
      "communications": 1,
      "security": 1,
      "hospitality-technology": 1,
      "autonomous-vehicles": 2,
      "enterprise-and-defense-software": 1,
      "media-and-entertainment": 1,
      "ai-search": 1,
      "robotics-foundation-models": 1,
      "enterprise-ai-agents": 2,
      "public-sector": 1
    },
    "assessment": {
      "status": "expanding",
      "semantics": "Coverage of the declared employer-source design only; never a claim of labor-market representativeness.",
      "targets": {
        "minimumEmployers": 50,
        "minimumSectors": 25,
        "maximumLargestEmployerShare": 0.15,
        "minimumCompensationCoverage": 0.65,
        "requiredSectors": [
          "frontier-model-lab",
          "ai-safety-research",
          "healthcare-ai",
          "biotechnology",
          "industrial-iot",
          "financial-technology",
          "education-technology",
          "legal-technology",
          "commerce-marketplace",
          "design-collaboration",
          "professional-services",
          "public-sector",
          "manufacturing",
          "energy",
          "agriculture"
        ]
      },
      "actual": {
        "employers": 54,
        "sectors": 38,
        "largestEmployerShare": 0.1854,
        "compensationCoverage": 0.608
      },
      "checks": {
        "minimumEmployers": true,
        "minimumSectors": true,
        "maximumLargestEmployerShare": false,
        "minimumCompensationCoverage": false,
        "requiredSectors": true
      },
      "missingRequiredSectors": []
    },
    "largestEmployerShare": 0.1854,
    "herfindahlHirschmanIndex": 0.0652,
    "entityResolution": {
      "methodVersion": "jobservatory-entity-resolution-0.1.0",
      "postingFamilies": 2336,
      "multiObservationFamilies": 252,
      "exactVariantGroups": 2664,
      "repostCandidateGroups": 36,
      "observationsInRepostCandidateGroups": 74,
      "reviewStatus": "unreviewed",
      "interpretation": "Candidate metadata clusters for leakage control and review; not verified requisitions or reposts."
    }
  },
  "provenance": {
    "sourceRegistryVersion": "jobservatory-sources-2026-08-17.6",
    "sourceManifests": 54,
    "allFeedsSuccessful": true,
    "allFeedResponsesHashed": true,
    "durableVersionLedger": "data/observation_versions.ndjson",
    "dailyPresenceSnapshots": "data/snapshots/YYYY-MM-DD.json"
  },
  "rights": {
    "reviewStatusCounts": {
      "pending": 54
    },
    "allSourcesApproved": false,
    "accessBasis": [
      "official-public-job-board-api",
      "official-public-job-posting-api",
      "official-public-posting-api",
      "official-public-postings-api"
    ],
    "fullDescriptionsRepublished": false,
    "modelTrainingPermitted": false,
    "notice": "A documented public API establishes technical access, not permission to redistribute employer-authored content or train models. Those reviews remain separate and fail closed."
  },
  "labels": {
    "extractionVersion": "jobservatory-rules-0.2.5",
    "ontologyVersion": "jobservatory-ontology-0.3.0",
    "reviewStatus": "unreviewed",
    "onetVersion": "30.3",
    "onetLicense": "CC BY 4.0",
    "semantics": "Rule-derived labels and O*NET candidates are unreviewed inferences; occupation-inherited profiles are context, not listing facts."
  },
  "intendedUses": [
    "labor-market research within the declared source universe",
    "retrieval and classification evaluation",
    "aggregate term and compensation analysis with coverage warnings"
  ],
  "prohibitedUses": [
    "automated employment decisions",
    "candidate screening or rejection",
    "claims of labor-market representativeness",
    "model training on source content until rights approval"
  ],
  "knownLimitations": [
    "Curated employer cohort",
    "source and employer concentration",
    "one-day longitudinal history at initial publication",
    "unreviewed weak labels",
    "missing compensation is not missing at random",
    "repost and location-variant groups are unreviewed metadata candidates, not verified shared requisitions"
  ]
}
